{
  "change_id": "example-change-001",
  "source_ref": "example://policy/customer-discount",
  "change_type": "modify",
  "reason": "更新折扣审批阈值的解释文本",
  "before_sha256": "0000000000000000000000000000000000000000000000000000000000000000",
  "after_sha256": "1111111111111111111111111111111111111111111111111111111111111111",
  "requested_mode": "dry-run",
  "authorization_ref": null,
  "scope": ["policy-text", "decision-card-template"],
  "created_at": "2026-01-01T00:00:00Z"
}
